<?xml version="1.0" encoding="UTF-8"?>
<!DOCTYPE pkgmetadata SYSTEM "https://www.gentoo.org/dtd/metadata.dtd">
<pkgmetadata>
	<maintainer type="person" proxied="yes">
		<email>mario.haustein@hrz.tu-chemnitz.de</email>
		<name>Mario Haustein</name>
	</maintainer>
	<maintainer type="project" proxied="proxy">
		<email>proxy-maint@gentoo.org</email>
		<name>Proxy Maintainers</name>
	</maintainer>
	<upstream>
		<remote-id type="github">lock042/ser-player</remote-id>
	</upstream>
</pkgmetadata>
