<?xml version="1.0" encoding="UTF-8"?>
<!DOCTYPE pkgmetadata SYSTEM "https://www.gentoo.org/dtd/metadata.dtd">
<pkgmetadata>
  <maintainer type="project">
    <email>x11@gentoo.org</email>
    <name>X11</name>
  </maintainer>
  <use>
    <flag name="llvm">Enable LLVM backend for Gallium3D.</flag>
    <flag name="lm-sensors">Enable Gallium HUD lm-sensors support.</flag>
    <flag name="opencl">Enable the Rusticl Gallium OpenCL state tracker.</flag>
    <flag name="proprietary-codecs">Enable codecs for patent-encumbered audio and video formats.</flag>
    <flag name="sysprof">Enable profiling data capture support using <pkg>dev-util/sysprof-capture</pkg></flag>
    <flag name="wayland">Enable support for <pkg>dev-libs/wayland</pkg></flag>
  </use>
  <upstream>
    <remote-id type="cpe">cpe:/a:mesa3d:mesa</remote-id>
    <remote-id type="freedesktop-gitlab">mesa/mesa</remote-id>
  </upstream>
</pkgmetadata>
