<?xml version="1.0" encoding="UTF-8"?>
<!DOCTYPE pkgmetadata SYSTEM "https://www.gentoo.org/dtd/metadata.dtd">
<pkgmetadata>
	<maintainer type="person" proxied="yes">
		<email>vi@vimproved.dev</email>
		<name>Violet Purcell</name>
	</maintainer>
	<maintainer type="project" proxied="proxy">
		<email>proxy-maint@gentoo.org</email>
		<name>Proxy Maintainers</name>
	</maintainer>
	<maintainer type="project">
		<email>sound@gentoo.org</email>
		<name>Gentoo Sound project</name>
	</maintainer>
	<upstream>
		<remote-id type="sourceforge">mscore</remote-id>
		<remote-id type="github">musescore/MuseScore</remote-id>
	</upstream>
	<use>
		<flag name="pipewire">Enable PipeWire audio support (upstream's default)</flag>
		<flag name="video">Support exporting scores as videos using the command line</flag>
		<flag name="websockets">Enable websockets support</flag>
	</use>
</pkgmetadata>
