<?xml version="1.0" encoding="UTF-8"?>
<!DOCTYPE pkgmetadata SYSTEM "https://www.gentoo.org/dtd/metadata.dtd">
<pkgmetadata>
	<maintainer type="project">
		<email>haskell@gentoo.org</email>
		<name>Gentoo Haskell</name>
	</maintainer>
	<use>
		<flag name="curl">Use libcurl for HTTP support.</flag>
		<flag name="terminfo">Use the terminfo package for enhanced console support.</flag>
	</use>
	<upstream>
		<remote-id type="hackage">darcs</remote-id>
	</upstream>
</pkgmetadata>
