<?xml version="1.0" encoding="UTF-8"?>
<!DOCTYPE pkgmetadata SYSTEM "https://www.gentoo.org/dtd/metadata.dtd">
<pkgmetadata>
    <maintainer type="person">
        <email>oz.tiram@gmail.com</email>
        <name>Oz Tiram</name>
    </maintainer>
    <maintainer type="project">
        <email>proxy-maint@gentoo.org</email>
        <name>Proxy Maintainers</name>
    </maintainer>
	<maintainer type="person">
		<email>arthurzam@gentoo.org</email>
		<name>Arthur Zamarin</name>
	</maintainer>
    <upstream>
        <remote-id type="github">go-delve/delve</remote-id>
    </upstream>
</pkgmetadata>
