<?xml version="1.0" encoding="UTF-8"?>
<!DOCTYPE pkgmetadata SYSTEM "https://www.gentoo.org/dtd/metadata.dtd">
<pkgmetadata>
	<maintainer type="person" proxied="yes">
		<email>brahmajit.xyz@gmail.com</email>
		<name>Brahmajit Das</name>
	</maintainer>
	<maintainer type="project" proxied="proxy">
		<email>proxy-maint@gentoo.org</email>
		<name>Proxy Maintainers</name>
	</maintainer>
	<upstream>
		<remote-id type="gitlab">wavexx/acpilight</remote-id>
	</upstream>
</pkgmetadata>
