<?xml version="1.0" encoding="UTF-8"?>
<!DOCTYPE pkgmetadata SYSTEM "https://www.gentoo.org/dtd/metadata.dtd">
<pkgmetadata>
	<maintainer type="person">
		<email>mschiff@gentoo.org</email>
		<name>Marc Schiffbauer</name>
	</maintainer>
	<maintainer type="project">
		<email>cluster@gentoo.org</email>
		<name>Gentoo Cluster Project</name>
	</maintainer>
	<upstream>
		<remote-id type="codeberg">sanlock/sanlock</remote-id>
	</upstream>
</pkgmetadata>
