<?xml version="1.0" encoding="UTF-8"?>
<!DOCTYPE pkgmetadata SYSTEM "https://www.gentoo.org/dtd/metadata.dtd">
<pkgmetadata>
	<maintainer type="project">
		<email>python@gentoo.org</email>
		<name>Python</name>
	</maintainer>
	<upstream>
		<remote-id type="github">nschloe/pytest-codeblocks</remote-id>
		<remote-id type="pypi">pytest-codeblocks</remote-id>
	</upstream>
	<stabilize-allarches/>
</pkgmetadata>
