<?xml version="1.0" encoding="UTF-8"?>
<!DOCTYPE pkgmetadata SYSTEM "https://www.gentoo.org/dtd/metadata.dtd">
<pkgmetadata>
	<maintainer type="person">
		<email>sam@gentoo.org</email>
		<name>Sam James</name>
	</maintainer>
	<use>
		<flag name="tcmalloc">
			Use tcmalloc from <pkg>dev-util/google-perftools</pkg> for allocations.
		</flag>
	</use>
	<upstream>
		<remote-id type="github">valkey-io/valkey</remote-id>
	</upstream>
</pkgmetadata>
